district,schoolName,schoolAddress,medianResult,unit,lead,status,city,county,latitude,longitude,maxResult
Sulphur Springs Union,Canyon Springs Community Elementary,19059 Vicci Street Canyon Country CA 91351-3380,,,False,tested,Santa Clarita,Los Angeles County,34.419118,-118.46821399999999,
Sulphur Springs Union,Fair Oaks Ranch Community,26933 North Silverbell Lane Santa Clarita CA 91387-3802,,,False,tested,Santa Clarita,Los Angeles County,34.403348,-118.448718,
Sulphur Springs Union,Golden Oak Community,25201 Via Princessa Santa Clarita CA 91321-1429,,,False,tested,Santa Clarita,Los Angeles County,34.399221000000004,-118.532752,
Sulphur Springs Union,Leona H. Cox Community Elementary,18643 Oakmoor Canyon Country CA 91351-2936,,,False,tested,Santa Clarita,Los Angeles County,34.426901,-118.45950900000001,
Sulphur Springs Union,Mint Canyon Community Elementary,16400 Sierra Highway Canyon Country CA 91351-1414,,,False,tested,Santa Clarita,Los Angeles County,34.405627,-118.464782,
Sulphur Springs Union,Mitchell Community Elementary,16821 West Goodvale Street Canyon Country CA 91387-1714,,,False,tested,Santa Clarita,Los Angeles County,34.428686,-118.429763,
Sulphur Springs Union,Pinetree Community Elementary,29156 Lotusgarden Drive Canyon Country CA 91387-1840,,,False,tested,Santa Clarita,Los Angeles County,34.435905,-118.40313,
Sulphur Springs Union,Sulphur Springs Community Elementary,16628 West Lost Canyon Road Canyon Country CA 91387-3241,,,False,tested,,Los Angeles County,34.410493,-118.44073600000002,
Sulphur Springs Union,Valley View Community Elementary,19414 Sierra Estates Drive Newhall CA 91321-2196,,,False,tested,Santa Clarita,Los Angeles County,34.397464,-118.47519199999999,
