district,schoolName,schoolAddress,medianResult,unit,lead,status,city,county,latitude,longitude,maxResult
Brawley Elementary,Barbara Worth Junior High,385 D Street Brawley CA 92227-1912,,,,not tested,Brawley,Imperial County,32.980959000000006,-115.535835,
Brawley Elementary,J. W. Oakley Elementary,1401 B Street Brawley CA 92227-1912,,,,not tested,Brawley,Imperial County,32.982981,-115.51881100000001,
Brawley Elementary,Miguel Hidalgo Elementary,615 South Cesar Chavez Street Brawley CA 92227-1912,,,,not tested,Brawley,Imperial County,32.972807,-115.526471,
Brawley Elementary,Myron D. Witter Elementary,150 K Street Brawley CA 92227-1912,,,,not tested,Brawley,Imperial County,32.973034999999996,-115.540529,
Brawley Elementary,Phil D. Swing Elementary,245 West A Street Brawley CA 92227-1912,,,,not tested,Brawley,Imperial County,32.984248,-115.54475900000001,
