district,schoolName,schoolAddress,medianResult,unit,lead,status,city,county,latitude,longitude
Hollister,Calaveras Elementary,1151 Buena Vista Road Suite 100 Hollister CA 95023-3329,NA,NA,FALSE,tested,Hollister,San Benito County,36.856512,-121.417314
Hollister,Calaveras Elementary/Accelerated Achievement Academy,1151 Buena Vista Road Suite 100 Hollister CA 95023-3329,NA,NA,NA,not tested,Hollister,San Benito County,36.856512,-121.417314
Hollister,Hollister Dual Language Academy,"873 Santa Ana Road, Suite 200 Hollister CA 95023-7115",NA,NA,NA,not tested,Hollister,San Benito County,36.853868,-121.385965
San Benito County Office of Education,San Benito County Regional Special Education Center,"1011 Line Street, Suite 12 Hollister CA 95023-4589",NA,NA,NA,not tested,Hollister,San Benito County,36.845078,-121.41238
North County Joint Union Elementary,Spring Grove Elementary,500 Spring Grove Road Hollister CA 95023-9366,NA,NA,NA,not tested,Hollister,San Benito County,36.914925,-121.360312
